id,name,calories
13929,"Beef, top sirloin, steak, separable lean and fat, trimmed to 1/8"" fat, all grades, raw",201
13932,"Beef, top sirloin, steak, separable lean and fat, trimmed to 1/8"" fat, choice, cooked, broiled",257
13933,"Beef, top sirloin, steak, separable lean and fat, trimmed to 1/8"" fat, choice, cooked, pan-fried",313
13931,"Beef, top sirloin, steak, separable lean and fat, trimmed to 1/8"" fat, choice, raw",214
13935,"Beef, top sirloin, steak, separable lean and fat, trimmed to 1/8"" fat, select, cooked, broiled",230
13934,"Beef, top sirloin, steak, separable lean and fat, trimmed to 1/8"" fat, select, raw",189
13454,"Beef, top sirloin, steak, separable lean only, trimmed to 0"" fat, all grades, cooked, broiled",183
13455,"Beef, top sirloin, steak, separable lean only, trimmed to 0"" fat, choice, cooked, broiled",188
13456,"Beef, top sirloin, steak, separable lean only, trimmed to 0"" fat, select, cooked, broiled",177
23610,"Beef, top sirloin, steak, separable lean only, trimmed to 1/8"" fat, all grades, cooked, broiled",178
23611,"Beef, top sirloin, steak, separable lean only, trimmed to 1/8"" fat, all grades, raw",131
23629,"Beef, top sirloin, steak, separable lean only, trimmed to 1/8"" fat, choice, cooked, broiled",187
23625,"Beef, top sirloin, steak, separable lean only, trimmed to 1/8"" fat, choice, raw",135
23588,"Beef, top sirloin, steak, separable lean only, trimmed to 1/8"" fat, select, cooked, broiled",170
23584,"Beef, top sirloin, steak, separable lean only, trimmed to 1/8"" fat, select, raw",127
13319,"Beef, variety meats and by-products, brain, cooked, pan-fried",196
13320,"Beef, variety meats and by-products, brain, cooked, simmered",151
13318,"Beef, variety meats and by-products, brain, raw",143
13322,"Beef, variety meats and by-products, heart, cooked, simmered",165
13321,"Beef, variety meats and by-products, heart, raw",112
13324,"Beef, variety meats and by-products, kidneys, cooked, simmered",158
13323,"Beef, variety meats and by-products, kidneys, raw",99
13326,"Beef, variety meats and by-products, liver, cooked, braised",191
13327,"Beef, variety meats and by-products, liver, cooked, pan-fried",175
13325,"Beef, variety meats and by-products, liver, raw",135
13329,"Beef, variety meats and by-products, lungs, cooked, braised",120
13328,"Beef, variety meats and by-products, lungs, raw",92
13330,"Beef, variety meats and by-products, mechanically separated beef, raw",276
13332,"Beef, variety meats and by-products, pancreas, cooked, braised",271
13331,"Beef, variety meats and by-products, pancreas, raw",235
13334,"Beef, variety meats and by-products, spleen, cooked, braised",145
13333,"Beef, variety meats and by-products, spleen, raw",105
13335,"Beef, variety meats and by-products, suet, raw",854
13338,"Beef, variety meats and by-products, thymus, cooked, braised",319
13337,"Beef, variety meats and by-products, thymus, raw",236
13340,"Beef, variety meats and by-products, tongue, cooked, simmered",284
13339,"Beef, variety meats and by-products, tongue, raw",224
23640,"Beef, variety meats and by-products, tripe, cooked, simmered",94
13341,"Beef, variety meats and by-products, tripe, raw",85
7003,"Beerwurst, beer salami, pork",238
7002,"Beerwurst, beer salami, pork and beef",277
7931,"Beerwurst, pork and beef",276
11736,"Beet greens, cooked, boiled, drained, with salt",27
11087,"Beet greens, cooked, boiled, drained, without salt",27
11086,"Beet greens, raw",22
11084,"Beets, canned, drained solids",31
11735,"Beets, canned, no salt added, solids and liquids",28
11082,"Beets, canned, regular pack, solids and liquids",30
11081,"Beets, cooked, boiled, drained",44
11734,"Beets, cooked, boiled. drained, with salt",44
11605,"Beets, harvard, canned, solids and liquids",73
11609,"Beets, pickled, canned, solids and liquids",65
11080,"Beets, raw",43
14638,"Beverage, Horchata, as served in restaurant",54
14631,"Beverage, Horchata, dry mix, unprepared, variety of brands, all with morro seeds",413
43205,"Beverage, instant breakfast powder, chocolate, not reconstituted",353
43260,"Beverage, instant breakfast powder, chocolate, sugar-free, not reconstituted",358
43078,"Beverage, milkshake mix, dry, not chocolate",329
14021,"Beverages,  Energy drink, Citrus",45
14644,"Beverages, , PEPSICO QUAKER, Gatorade G2, low calorie",8
14035,"Beverages, ABBOTT, EAS soy protein powder",405
14033,"Beverages, ABBOTT, EAS whey protein powder",385
43528,"Beverages, ABBOTT, ENSURE PLUS, ready-to-drink",141
14062,"Beverages, ABBOTT, ENSURE, Nutritional Shake, Ready-to-Drink",105
14531,"Beverages, alcoholic , whiskey sour",149
14054,"Beverages, almond milk, chocolate, ready-to-drink",50
14016,"Beverages, almond milk, sweetened, vanilla flavor, ready-to-drink",38
14083,"Beverages, Chocolate malt, powder, prepared with fat free milk",49
14063,"Beverages, chocolate powder, no sugar added",373
14461,"Beverages, COCA-COLA, POWERADE, lemon-lime flavored, ready-to-drink",32
14538,"Beverages, Cocoa mix, low calorie, powder, with added calcium, phosphorus, aspartame, without added sodium or vitamin A",359
14090,"Beverages, Coconut water, ready-to-drink",18
14036,"Beverages, CYTOSPORT, Muscle Milk, ready-to-drink",49
14060,"Beverages, Energy Drink with carbonated water and high fructose corn syrup",62
14030,"Beverages, energy drink, Original, grape, loaded cherry, charged citrus",44
14061,"Beverages, Energy Drink, sugar free",4
14026,"Beverages, Energy Drink, sugar-free with guarana",4
14042,"Beverages, fortified low calorie fruit juice beverage",4
14636,"Beverages, fruit juice drink, reduced sugar, with vitamin E added",39
14072,"Beverages, Green tea, brewed, from bags",1
14070,"Beverages, Green tea, LIPTON, brewed from bags",1
14071,"Beverages, Green tea, SALADA brewed from bags",1
14065,"Beverages, Hi-C Flashin' Fruit Punch",45
14076,"Beverages, ICELANDIC, Glacial Natural spring water",0
14068,"Beverages, KELLOGG'S SPECIAL K20, protein water mix",380
14059,"Beverages, KELLOGG'S, SPECIAL K Protein Shake",64
14022,"Beverages, MONSTER energy drink, low carb",5
14041,"Beverages, NESTLE, Boost plus, nutritional drink, ready-to-drink",138
14043,"Beverages, NESTLE, CARNATION BREAKFAST ESSENTIALS , nutritional drink, ready-to-drink, Rich milk chocolate flavor, no sugar added",45
14080,"Beverages, NESTLE, Ovaltine, rich chocolate, powder",364
14654,"Beverages, nutritional shake mix, high protein, powder",392
14038,"Beverages, OCEAN SPRAY, Cran-Energy, Cranberry Energy Juice Drink",15
14064,"Beverages, Orange juice, light, No pulp",21
14409,"Beverages, Orange-flavor drink, breakfast type, low calorie, powder",217
14315,"Beverages, OVALTINE, chocolate malt powder",372
14309,"Beverages, OVALTINE, Classic Malt powder",372
14460,"Beverages, PEPSICO QUAKER, Gatorade, G performance O 2, ready-to-drink.",26
14079,"Beverages, PEPSICO, Mountain Dew Original",49
14078,"Beverages, PEPSICO, Mountain Dew, Kickstart, Black Cherry",17
14599,"Beverages, Powerade Zero Ion4, calorie-free, assorted flavors",0
14462,"Beverages, Propel Zero, fruit-flavored, non-carbonated",5
14067,"Beverages, Protein powder soy based",388
14066,"Beverages, Protein powder whey based",352
14044,"Beverages, SLIMFAST, Meal replacement,  High Protein Shake, Ready-To-Drink, 3-2-1 plan",58
14055,"Beverages, UNILEVER, SLIMFAST Shake Mix, high protein, powder, 3-2-1 Plan",368
14047,"Beverages, UNILEVER, SLIMFAST Shake Mix, powder, 3-2-1 Plan",379
14045,"Beverages, UNILEVER, SLIMFAST, meal replacement, regular, ready-to-drink,  3-2-1 Plan",57
14635,"Beverages, vegetable and fruit juice blend, 100% juice, with added vitamins A, C, E",46
14605,"Beverages, Water with added vitamins and minerals, bottles, sweetened, assorted fruit flavors",22
14075,"Beverages, water, bottled, naturally sparkling (carbonated), mineral",0
14031,"Beverages, water, bottled, yumberry, pomegranate with anti-oxidants",5
14058,"Beverages, Whey protein powder isolate",359
14073,"Beverages, ZEVIA, cola",0
14074,"Beverages, ZEVIA, cola, caffeine free",0
18017,"Biscuits, mixed grain, refrigerated dough",263
18010,"Biscuits, plain or buttermilk, dry mix",428
18011,"Biscuits, plain or buttermilk, dry mix, prepared",335
18009,"Biscuits, plain or buttermilk, frozen, baked",338
18016,"Biscuits, plain or buttermilk, prepared from recipe",353
18014,"Biscuits, plain or buttermilk, refrigerated dough, higher fat",307
18015,"Biscuits, plain or buttermilk, refrigerated dough, higher fat, baked",324
18012,"Biscuits, plain or buttermilk, refrigerated dough, lower fat",270
18013,"Biscuits, plain or buttermilk, refrigerated dough, lower fat, baked",299
17148,"Bison, ground, grass-fed, cooked",179
17149,"Bison, ground, grass-fed, raw",146
9046,"Blackberries, canned, heavy syrup, solids and liquids",92
9048,"Blackberries, frozen, unsweetened",64
9042,"Blackberries, raw",43
35015,"Blackberries, wild, raw (Alaska Native)",52
9043,"Blackberry juice, canned",38
7005,Blood sausage,379
9052,"Blueberries, canned, heavy syrup, solids and liquids",88
9352,"Blueberries, canned, light syrup, drained",88
9163,"Blueberries, dried, sweetened",317
9055,"Blueberries, frozen, sweetened",85
9054,"Blueberries, frozen, unsweetened",51
9050,"Blueberries, raw",57
9353,"Blueberries, wild, canned, heavy syrup, drained",107
9053,"Blueberries, wild, frozen",57
7006,"Bockwurst, pork, veal, raw",301
7007,"Bologna, beef",299
7008,"Bologna, beef and pork",308
42129,"Bologna, beef and pork, low fat",230
42161,"Bologna, beef, low fat",204
7960,"Bologna, chicken, pork",336
7959,"Bologna, chicken, pork, beef",272
7952,"Bologna, chicken, turkey, pork",298
7971,"Bologna, meat and poultry",281
7010,"Bologna, pork",247
7936,"Bologna, pork and turkey, lite",211
7937,"Bologna, pork, turkey and beef",336
7011,"Bologna, turkey",209
11613,"Borage, raw",21
9056,"Boysenberries, canned, heavy syrup",88
9057,"Boysenberries, frozen, unsweetened",50
7922,"Bratwurst, beef and pork, smoked",297
7923,"Bratwurst, chicken, cooked",176
7924,"Bratwurst, pork, beef and turkey, lite, smoked",186
7013,"Bratwurst, pork, cooked",333
7910,"Bratwurst, veal, cooked",341
7014,"Braunschweiger (a liver sausage), pork",327
18079,"Bread crumbs, dry, grated, plain",395
18376,"Bread crumbs, dry, grated, seasoned",383
18080,"Bread sticks, plain",412
18081,"Bread stuffing, bread, dry mix",386
18082,"Bread stuffing, bread, dry mix, prepared",177
18084,"Bread stuffing, cornbread, dry mix",389
18085,"Bread stuffing, cornbread, dry mix, prepared",179
18019,"Bread, banana, prepared from recipe, made with margarine",326
18021,"Bread, boston brown, canned",195
28306,"Bread, chapati or roti, plain, commercially prepared",297
28285,"Bread, chapati or roti, whole wheat, frozen",299
18972,"Bread, cheese",408
18022,"Bread, cornbread, dry mix, enriched (includes corn muffin mix)",418
18023,"Bread, cornbread, dry mix, prepared with 2% milk, 80% margarine, and eggs",330
18412,"Bread, cornbread, dry mix, unenriched (includes corn muffin mix)",418
18024,"Bread, cornbread, prepared from recipe, made with low fat (2%) milk",266
18025,"Bread, cracked-wheat",260
18027,"Bread, egg",287
18028,"Bread, egg, toasted",315
18029,"Bread, french or vienna (includes sourdough)",272
18030,"Bread, french or vienna, toasted (includes sourdough)",319
18032,"Bread, irish soda, prepared from recipe",290
18033,"Bread, italian",271
35140,"Bread, kneel down (Navajo)",195
18035,"Bread, Multi-Grain (includes whole-grain)",265
18036,"Bread, Multi-Grain, toasted (includes whole-grain)",288
28307,"Bread, naan (Indian bread), plain, commercially prepared, refrigerated",291
28287,"Bread, naan (Indian bread), whole wheat, refrigerated",286
18037,"Bread, oat bran",236
18038,"Bread, oat bran, toasted",259
18039,"Bread, oatmeal",269
18040,"Bread, oatmeal, toasted",292
18955,"Bread, pan dulce, sweet yeast bread",367
28286,"Bread, paratha (Indian bread), whole wheat, frozen",326
18041,"Bread, pita, white, enriched",275
18413,"Bread, pita, white, unenriched",275
18042,"Bread, pita, whole-wheat",266
18971,"Bread, potato",266
18954,"Bread, pound cake type, pan de torta salvadoran",390
18043,"Bread, protein (includes gluten)",245
18383,"Bread, protein, toasted (includes gluten)",270
18044,"Bread, pumpernickel",250
18045,"Bread, pumpernickel, toasted",275
18047,"Bread, raisin, enriched",274
18048,"Bread, raisin, toasted, enriched",297
18414,"Bread, raisin, unenriched",274
18049,"Bread, reduced-calorie, oat bran",201
18050,"Bread, reduced-calorie, oat bran, toasted",239
18051,"Bread, reduced-calorie, oatmeal",210
18053,"Bread, reduced-calorie, rye",203
18055,"Bread, reduced-calorie, wheat",217
18057,"Bread, reduced-calorie, white",207
18059,"Bread, rice bran",243
18384,"Bread, rice bran, toasted",264
28288,"Bread, roll, Mexican, bollilo",318
18060,"Bread, rye",259
18061,"Bread, rye, toasted",284
18953,"Bread, salvadoran sweet cheese (quesadilla salvadorena)",374
18064,"Bread, wheat",267
18066,"Bread, wheat bran",248
18068,"Bread, wheat germ",261
18385,"Bread, wheat germ, toasted",293
18065,"Bread, wheat, toasted",313
18967,"Bread, wheat, white wheat",238
18069,"Bread, white, commercially prepared (includes soft bread crumbs)",266
18416,"Bread, white, commercially prepared, low sodium, no salt",267
18070,"Bread, white, commercially prepared, toasted",293
18432,"Bread, white, commercially prepared, toasted, low sodium no salt",293
18073,"Bread, white, prepared from recipe, made with low fat (2%) milk",285
18071,"Bread, white, prepared from recipe, made with nonfat dry milk",274
18075,"Bread, whole-wheat, commercially prepared",252
18076,"Bread, whole-wheat, commercially prepared, toasted",306
18077,"Bread, whole-wheat, prepared from recipe",278
18078,"Bread, whole-wheat, prepared from recipe, toasted",305
9059,"Breadfruit, raw",103
43595,"Breakfast bar, corn flake crust with fruit",377
43100,"Breakfast bars, oats, sugar, raisins, coconut (include granola bar)",464
18459,"Breakfast tart, low fat",372
16054,"Broadbeans (fava beans), mature seeds, canned",71
16353,"Broadbeans (fava beans), mature seeds, cooked, boiled, with salt",110
16053,"Broadbeans (fava beans), mature seeds, cooked, boiled, without salt",110
16052,"Broadbeans (fava beans), mature seeds, raw",341
11088,"Broadbeans, immature seeds, raw",72
11097,"Broccoli raab, cooked",33
11096,"Broccoli raab, raw",22
11969,"Broccoli, chinese, cooked",22
11742,"Broccoli, cooked, boiled, drained, with salt",35
11091,"Broccoli, cooked, boiled, drained, without salt",35
11740,"Broccoli, flower clusters, raw",28
11743,"Broccoli, frozen, chopped, cooked, boiled, drained, with salt",28
11093,"Broccoli, frozen, chopped, cooked, boiled, drained, without salt",28
11092,"Broccoli, frozen, chopped, unprepared",26
11744,"Broccoli, frozen, spears, cooked, boiled, drained, with salt",28
11095,"Broccoli, frozen, spears, cooked, boiled, drained, without salt",28
11094,"Broccoli, frozen, spears, unprepared",29
11090,"Broccoli, raw",34
11741,"Broccoli, stalks, raw",28
7015,"Brotwurst, pork, beef, link",323
11745,"Brussels sprouts, cooked, boiled, drained, with salt",36
11099,"Brussels sprouts, cooked, boiled, drained, without salt",36
11746,"Brussels sprouts, frozen, cooked, boiled, drained, with salt",42
11101,"Brussels sprouts, frozen, cooked, boiled, drained, without salt",42
11100,"Brussels sprouts, frozen, unprepared",41
11098,"Brussels sprouts, raw",43
20008,Buckwheat,343
20011,"Buckwheat flour, whole-groat",335
20010,"Buckwheat groats, roasted, cooked",92
20009,"Buckwheat groats, roasted, dry",346
20013,"Bulgur, cooked",83
20012,"Bulgur, dry",342
11747,"Burdock root, cooked, boiled, drained, with salt",88
11105,"Burdock root, cooked, boiled, drained, without salt",88
11104,"Burdock root, raw",72
21251,"BURGER KING, Cheeseburger",286
21256,"BURGER KING, Chicken Strips",292
21385,"BURGER KING, CROISSAN'WICH with Egg and Cheese",283
21384,"BURGER KING, CROISSAN'WICH with Sausage and Cheese",376
21383,"BURGER KING, CROISSAN'WICH with Sausage, Egg and Cheese",308
21506,"BURGER KING, Double Cheeseburger",282
21254,"BURGER KING, DOUBLE WHOPPER, no cheese",252
21255,"BURGER KING, DOUBLE WHOPPER, with cheese",266
21249,"BURGER KING, french fries",280
21386,"BURGER KING, french toast sticks",349
21250,"BURGER KING, Hamburger",261
21387,"BURGER KING, Hash Brown Rounds",302
21509,"BURGER KING, Onion Rings",417
21259,"BURGER KING, Original Chicken Sandwich",286
21258,"BURGER KING, Premium Fish Sandwich",260
21141,"BURGER KING, Vanilla Shake",168
21252,"BURGER KING, WHOPPER, no cheese",233
21253,"BURGER KING, WHOPPER, with cheese",250
22918,"Burrito, bean and cheese, frozen",221
22917,"Burrito, beef and bean, frozen",239
22928,"Burrito, beef and bean, microwaved",298
7269,"BUTCHER BOY MEATS, INC., Turkey Franks",239
1003,"Butter oil, anhydrous",876
43214,"Butter replacement, without fat, powder",373
4601,"Butter, light, stick, with salt",509
4602,"Butter, light, stick, without salt",499
1001,"Butter, salted",717
1002,"Butter, whipped, with salt",717
1145,"Butter, without salt",717
11106,"Butterbur, (fuki), raw",14
11108,"Butterbur, canned",3
11754,"Cabbage, chinese (pak-choi), cooked, boiled, drained, with salt",12
11117,"Cabbage, chinese (pak-choi), cooked, boiled, drained, without salt",12
11116,"Cabbage, chinese (pak-choi), raw",13
11755,"Cabbage, chinese (pe-tsai), cooked, boiled, drained, with salt",14
11120,"Cabbage, chinese (pe-tsai), cooked, boiled, drained, without salt",14
11119,"Cabbage, chinese (pe-tsai), raw",16
11749,"Cabbage, common (danish, domestic, and pointed types), freshly harvest, raw",24
11750,"Cabbage, common (danish, domestic, and pointed types), stored, raw",24
11751,"Cabbage, common, cooked, boiled, drained, with salt",23
11110,"Cabbage, cooked, boiled, drained, without salt",23
43143,"Cabbage, japanese style, fresh, pickled",30
43144,"Cabbage, mustard, salted",28
11970,"Cabbage, napa, cooked",12
11109,"Cabbage, raw",25
11752,"Cabbage, red, cooked, boiled, drained, with salt",29
11113,"Cabbage, red, cooked, boiled, drained, without salt",29
11112,"Cabbage, red, raw",31
11753,"Cabbage, savoy, cooked, boiled, drained, with salt",24
11115,"Cabbage, savoy, cooked, boiled, drained, without salt",24
11114,"Cabbage, savoy, raw",27
18087,"Cake mix, angelfood, dry",366
18112,"Cake mix, pudding, dry, german chocolate",350
18086,"Cake, angelfood, commercially prepared",258
18088,"Cake, angelfood, dry mix, prepared",257
18090,"Cake, boston cream pie, commercially prepared",252
18092,"Cake, carrot, dry mix, pudding-type",415
18095,"Cake, cherry fudge with chocolate frosting",264
18096,"Cake, chocolate, commercially prepared with chocolate frosting, in-store bakery",389
18097,"Cake, chocolate, dry mix, pudding-type",391
18101,"Cake, chocolate, prepared from recipe without frosting",371
18110,"Cake, fruitcake, commercially prepared",324
18114,"Cake, gingerbread, dry mix",437
18116,"Cake, gingerbread, prepared from recipe",356
18117,"Cake, marble, dry mix, pudding-type",416
18119,"Cake, pineapple upside-down, prepared from recipe",319
18957,"Cake, pound, BIMBO Bakeries USA, Panque Casero, home baked style",418
18120,"Cake, pound, commercially prepared, butter (includes fresh and frozen)",353
18451,"Cake, pound, commercially prepared, fat-free",283
18121,"Cake, pound, commercially prepared, other than all butter, enriched",389
18418,"Cake, pound, commercially prepared, other than all butter, unenriched",389
18126,"Cake, shortcake, biscuit-type, prepared from recipe",346
18127,"Cake, snack cakes, creme-filled, chocolate with frosting",399
28296,"Cake, snack cakes, creme-filled, chocolate with frosting, low-fat",409
18128,"Cake, snack cakes, creme-filled, sponge",374
28297,"Cake, snack cakes, not chocolate, with icing or filling, low-fat",405
18133,"Cake, sponge, commercially prepared",290
18134,"Cake, sponge, prepared from recipe",297
18135,"Cake, white, dry mix, pudding-type, enriched",423
18419,"Cake, white, dry mix, pudding-type, unenriched",423
18131,"Cake, white, dry mix, special dietary (includes lemon-flavored)",397
18102,"Cake, white, prepared from recipe with coconut frosting",356
18139,"Cake, white, prepared from recipe without frosting",357
18140,"Cake, yellow, commercially prepared, with chocolate frosting, in-store bakery",379
18141,"Cake, yellow, commercially prepared, with vanilla frosting",391
18453,"Cake, yellow, dry mix, light",404
18142,"Cake, yellow, dry mix, pudding-type",423
18144,"Cake, yellow, dry mix, regular, enriched",374
18420,"Cake, yellow, dry mix, regular, unenriched",432
18146,"Cake, yellow, prepared from recipe without frosting",361
6996,CAMPBELL'S Au Jus Gravy,8
6997,CAMPBELL'S Beef Gravy,42
6998,CAMPBELL'S Brown Gravy with Onions,42
16200,Campbell's Brown Sugar And Bacon Flavored Baked Beans,123
6999,CAMPBELL'S Chicken Gravy,68
6241,"CAMPBELL'S CHUNKY Microwavable Bowls, Beef with Country Vegetables Soup, ready-to-serve",61
6242,"CAMPBELL'S CHUNKY Microwavable Bowls, Chicken and Dumplings Soup, ready-to-serve",78
6244,"CAMPBELL'S CHUNKY Microwavable Bowls, Classic Chicken Noodle, ready-to-serve",45
6245,"CAMPBELL'S CHUNKY Microwavable Bowls, Grilled Chicken and Sausage Gumbo, ready-to-serve",57
6250,"CAMPBELL'S CHUNKY Microwavable Bowls, New England Clam Chowder, ready-to-serve",82
6251,"CAMPBELL'S CHUNKY Microwavable Bowls, Old Fashioned Vegetable Beef Soup, ready-to-serve",41
6252,"CAMPBELL'S CHUNKY Microwavable Bowls, Sirloin Burger with Country Vegetables Soup, ready-to-serve",57
6383,"CAMPBELL'S CHUNKY Soups, Baked Potato with Cheddar  &  Bacon Bits Soup",78
6384,"CAMPBELL'S CHUNKY Soups, Baked Potato with Steak  &  Cheese Soup",82
6387,"CAMPBELL'S CHUNKY Soups, Beef Rib Roast with Potatoes  &  Herbs Soup",44
6388,"CAMPBELL'S CHUNKY Soups, Beef with Country Vegetables Soup",53
6389,"CAMPBELL'S CHUNKY Soups, Beef with White and Wild Rice Soup",57
6392,"CAMPBELL'S CHUNKY Soups, Chicken Broccoli Cheese  &  Potato Soup",86
6393,"CAMPBELL'S CHUNKY Soups, Chicken Corn Chowder",82
6396,"CAMPBELL'S CHUNKY Soups, Fajita Chicken with Rice  &  Beans Soup",53
6398,"CAMPBELL'S CHUNKY Soups, Firehouse - Hot  &  Spicy Beef &amp; Bean Chili",95
6399,"CAMPBELL'S CHUNKY Soups, Grilled Chicken  &  Sausage Gumbo Soup",57
6400,"CAMPBELL'S CHUNKY Soups, Grilled Chicken with Vegetables  &  Pasta Soup",41
6403,"CAMPBELL'S CHUNKY Soups, Grilled Sirloin Steak with Hearty Vegetables Soup",51
6454,"CAMPBELL'S CHUNKY Soups, Grilled Steak- Steak Chili with Beans",81
27007,"CAMPBELL'S CHUNKY Soups, HEALTHY REQUEST Microwavable Bowls, Chicken Noodle Soup",49
27008,"CAMPBELL'S CHUNKY Soups, HEALTHY REQUEST Microwavable Bowls, Grilled Chicken  &  Sausage Gumbo Soup",53
27009,"CAMPBELL'S CHUNKY Soups, HEALTHY REQUEST New England Clam Chowder",53
6408,"CAMPBELL'S CHUNKY Soups, HEALTHY REQUEST Vegetable Soup",49
6414,"CAMPBELL'S CHUNKY Soups, Hearty Bean 'N' Ham Soup",74
6415,"CAMPBELL'S CHUNKY Soups, Hearty Beef Barley Soup",65
6418,"CAMPBELL'S CHUNKY Soups, Hearty Chicken with Vegetables Soup",45
6429,"CAMPBELL'S CHUNKY Soups, Manhattan Clam Chowder",52
6433,"CAMPBELL'S CHUNKY Soups, Old Fashioned Potato Ham Chowder",78
6434,"CAMPBELL'S CHUNKY Soups, Old Fashioned Vegetable Beef Soup",49
6437,"CAMPBELL'S CHUNKY Soups, Roadhouse - Beef  &  Bean Chili",95
6438,"CAMPBELL'S CHUNKY Soups, Salisbury Steak with Mushrooms  &  Onions Soup",57
6439,"CAMPBELL'S CHUNKY Soups, Savory Chicken with White  &  Wild Rice Soup",45
6441,"CAMPBELL'S CHUNKY Soups, Savory Pot Roast Soup",49
6447,"CAMPBELL'S CHUNKY Soups, Savory Vegetable Soup",44
6457,"CAMPBELL'S CHUNKY Soups, Slow Roasted Beef with Mushrooms Soup",48
6459,"CAMPBELL'S CHUNKY Soups, Split Pea 'N' Ham Soup",78
6462,"CAMPBELL'S CHUNKY Soups, Steak 'N' Potato Soup",49
6395,"CAMPBELL'S CHUNKY, Classic Chicken Noodle Soup",47
6391,"CAMPBELL'S CHUNKY, Creamy Chicken and Dumplings Soup",66
6405,"CAMPBELL'S CHUNKY, HEALTHY REQUEST Chicken Noodle Soup",41
6431,"CAMPBELL'S CHUNKY, New England Clam Chowder",81
6318,CAMPBELL'S Country Style Cream Gravy,76
6319,CAMPBELL'S Country Style Sausage Gravy,119
6317,CAMPBELL'S Fat Free Beef Gravy,25
6320,CAMPBELL'S Fat Free Chicken Gravy,25
6323,CAMPBELL'S Fat Free Turkey Gravy,33
6321,CAMPBELL'S Golden Pork Gravy,76
6986,"CAMPBELL'S HEALTHY REQUEST, Chicken Noodle Soup, condensed",47
6195,"CAMPBELL'S HEALTHY REQUEST, Cream of Chicken Soup, condensed",50
6988,"CAMPBELL'S HEALTHY REQUEST, Cream of Mushroom Soup, condensed",55
6989,"CAMPBELL'S HEALTHY REQUEST, Homestyle Chicken Noodle Soup, condensed",51
6529,CAMPBELL'S Homestlye Light New England Clam Chowder,49
6548,CAMPBELL'S Homestyle Chicken with White  &  Wild Rice Soup,41
27019,CAMPBELL'S Homestyle Harvest Tomato with Basil Soup,45
27021,CAMPBELL'S Homestyle HEALTHY REQUEST Chicken with Whole Grain Pasta Soup,40
6537,CAMPBELL'S Homestyle HEALTHY REQUEST Mexican Style Chicken Tortilla,53
6541,CAMPBELL'S Homestyle Italian-Style Wedding Soup,49
6617,CAMPBELL'S Homestyle Light Italian-Style Wedding Soup,33
6543,CAMPBELL'S Homestyle Mexican Style Chicken Tortilla Soup,53
27017,"CAMPBELL'S Homestyle Microwaveable Bowls, HEALTHY REQUEST Italian Wedding Soup",41
27018,"CAMPBELL'S Homestyle Microwaveable Bowls, HEALTHY REQUEST Mexican Style Tortilla",53
6544,CAMPBELL'S Homestyle Minestrone Soup,41
6545,CAMPBELL'S Homestyle New England Clam Chowder,70
6546,CAMPBELL'S Homestyle Potato Broccoli Cheese Soup,65
6580,CAMPBELL'S Homestyle Vegetable Medley Soup,37
6470,"CAMPBELL'S Low Sodium Soups, Chicken Broth",10
6482,"CAMPBELL'S Low Sodium Soups, Chicken with Noodles Soup",52
6487,"CAMPBELL'S Low Sodium Soups, Cream of Mushroom Soup",54
6324,CAMPBELL'S Microwavable Beef Gravy,42
6325,CAMPBELL'S Microwavable Chicken Gravy,67
6332,CAMPBELL'S Microwavable Turkey Gravy,42
6322,CAMPBELL'S Mushroom Gravy,34
16201,Campbell's Pork and Beans,108
6497,"CAMPBELL'S Red and White - Microwaveable Bowls, Chicken Noodle Soup",30
6502,"CAMPBELL'S Red and White - Microwaveable Bowls, Chicken Rice Soup",30
6503,"CAMPBELL'S Red and White - Microwaveable Bowls, Creamy Tomato Soup",64
