id,name,calories
21056,"Fast foods, salad, vegetable, tossed, without dressing, with shrimp",45
21057,"Fast foods, salad, vegetables tossed, without dressing, with turkey, ham and cheese",82
21058,"Fast foods, scallops, breaded and fried",268
21059,"Fast foods, shrimp, breaded and fried",308
21124,"Fast foods, submarine sandwich, cold cut on white bread with lettuce and tomato",213
21125,"Fast foods, submarine sandwich, roast beef on white bread with lettuce and tomato",156
21126,"Fast foods, submarine sandwich, tuna on white bread with lettuce and tomato",218
21032,"Fast foods, sundae, caramel",196
21033,"Fast foods, sundae, hot fudge",180
21034,"Fast foods, sundae, strawberry",175
21083,"Fast foods, taco salad",141
21084,"Fast foods, taco salad with chili con carne",111
21082,"Fast foods, taco with beef, cheese and lettuce, hard shell",226
21486,"Fast foods, taco with beef, cheese and lettuce, soft",206
21487,"Fast foods, taco with chicken, lettuce and cheese, soft",189
21085,"Fast foods, tostada, with beans and cheese",155
21086,"Fast foods, tostada, with beans, beef, and cheese",148
21087,"Fast foods, tostada, with beef and cheese",193
21028,"Fast foods, vanilla, light, soft-serve ice cream, with cone",163
1243,"Fat free ice cream, no sugar added, flavors other than chocolate",129
4001,"Fat, beef tallow",902
4542,"Fat, chicken",900
4574,"Fat, duck",882
4576,"Fat, goose",900
4520,"Fat, mutton tallow",902
4575,"Fat, turkey",900
9334,"Feijoa, raw",61
11957,"Fennel, bulb, raw",31
9093,"Figs, canned, extra heavy syrup pack, solids and liquids",107
9092,"Figs, canned, heavy syrup pack, solids and liquids",88
9091,"Figs, canned, light syrup pack, solids and liquids",69
9090,"Figs, canned, water pack, solids and liquids",53
9095,"Figs, dried, stewed",107
9094,"Figs, dried, uncooked",249
9089,"Figs, raw",74
11985,"Fireweed, leaves, raw",103
6963,Fish broth,16
4589,"Fish oil, cod liver",902
4590,"Fish oil, herring",902
4591,"Fish oil, menhaden",902
4592,"Fish oil, menhaden, fully hydrogenated",902
4593,"Fish oil, salmon",902
4594,"Fish oil, sardine",902
43129,"Fish sticks, meatless",290
15002,"Fish, anchovy, european, canned in oil, drained solids",210
15001,"Fish, anchovy, european, raw",131
15003,"Fish, bass, fresh water, mixed species, raw",114
15187,"Fish, bass, freshwater, mixed species, cooked, dry heat",146
15188,"Fish, bass, striped, cooked, dry heat",124
15004,"Fish, bass, striped, raw",97
15189,"Fish, bluefish, cooked, dry heat",159
15005,"Fish, bluefish, raw",124
15190,"Fish, burbot, cooked, dry heat",115
15006,"Fish, burbot, raw",90
15191,"Fish, butterfish, cooked, dry heat",187
15007,"Fish, butterfish, raw",146
15009,"Fish, carp, cooked, dry heat",162
15008,"Fish, carp, raw",127
15011,"Fish, catfish, channel, cooked, breaded and fried",229
15235,"Fish, catfish, channel, farmed, cooked, dry heat",144
15234,"Fish, catfish, channel, farmed, raw",119
15233,"Fish, catfish, channel, wild, cooked, dry heat",105
15010,"Fish, catfish, channel, wild, raw",95
15012,"Fish, caviar, black and red, granular",264
15013,"Fish, cisco, raw",98
15014,"Fish, cisco, smoked",177
15017,"Fish, cod, Atlantic, canned, solids and liquid",105
15016,"Fish, cod, Atlantic, cooked, dry heat",105
15018,"Fish, cod, Atlantic, dried and salted",290
15015,"Fish, cod, Atlantic, raw",82
15192,"Fish, cod, Pacific, cooked, dry heat",85
15019,"Fish, cod, Pacific, raw",69
15269,"Fish, cod, Pacific, untreated, cooked",84
15268,"Fish, cod, Pacific, untreated, raw",72
15021,"Fish, croaker, Atlantic, cooked, breaded and fried",221
15020,"Fish, croaker, Atlantic, raw",104
15193,"Fish, cusk, cooked, dry heat",112
15022,"Fish, cusk, raw",87
15194,"Fish, dolphinfish, cooked, dry heat",109
15023,"Fish, dolphinfish, raw",85
15195,"Fish, drum, freshwater, cooked, dry heat",153
15024,"Fish, drum, freshwater, raw",119
15026,"Fish, eel, mixed species, cooked, dry heat",236
15025,"Fish, eel, mixed species, raw",184
15027,"Fish, fish sticks, frozen, prepared",277
15029,"Fish, flatfish (flounder and sole species), cooked, dry heat",86
15028,"Fish, flatfish (flounder and sole species), raw",70
15030,"Fish, gefiltefish, commercial, sweet recipe",84
15032,"Fish, grouper, mixed species, cooked, dry heat",118
15031,"Fish, grouper, mixed species, raw",92
15034,"Fish, haddock, cooked, dry heat",90
15033,"Fish, haddock, raw",74
15035,"Fish, haddock, smoked",116
15037,"Fish, halibut, Atlantic and Pacific, cooked, dry heat",111
15036,"Fish, halibut, Atlantic and Pacific, raw",91
15196,"Fish, halibut, greenland, cooked, dry heat",239
15038,"Fish, halibut, Greenland, raw",186
15040,"Fish, herring, Atlantic, cooked, dry heat",203
15042,"Fish, herring, Atlantic, kippered",217
15041,"Fish, herring, Atlantic, pickled",262
15039,"Fish, herring, Atlantic, raw",158
15197,"Fish, herring, Pacific, cooked, dry heat",250
15043,"Fish, herring, Pacific, raw",195
15198,"Fish, ling, cooked, dry heat",111
15044,"Fish, ling, raw",87
15199,"Fish, lingcod, cooked, dry heat",109
15045,"Fish, lingcod, raw",85
15047,"Fish, mackerel, Atlantic, cooked, dry heat",262
15046,"Fish, mackerel, Atlantic, raw",205
15048,"Fish, mackerel, jack, canned, drained solids",156
15200,"Fish, mackerel, king, cooked, dry heat",134
15049,"Fish, mackerel, king, raw",105
15201,"Fish, mackerel, Pacific and jack, mixed species, cooked, dry heat",201
15050,"Fish, mackerel, Pacific and jack, mixed species, raw",158
83110,"Fish, mackerel, salted",305
15052,"Fish, mackerel, spanish, cooked, dry heat",158
15051,"Fish, mackerel, spanish, raw",139
15202,"Fish, milkfish, cooked, dry heat",190
15053,"Fish, milkfish, raw",148
15203,"Fish, monkfish, cooked, dry heat",97
15054,"Fish, monkfish, raw",76
15056,"Fish, mullet, striped, cooked, dry heat",150
15055,"Fish, mullet, striped, raw",117
15058,"Fish, ocean perch, Atlantic, cooked, dry heat",96
15057,"Fish, ocean perch, Atlantic, raw",79
15061,"Fish, perch, mixed species, cooked, dry heat",117
15060,"Fish, perch, mixed species, raw",91
15063,"Fish, pike, northern, cooked, dry heat",113
15062,"Fish, pike, northern, raw",88
15204,"Fish, pike, walleye, cooked, dry heat",119
15064,"Fish, pike, walleye, raw",93
15067,"Fish, pollock, Alaska, cooked, dry heat",111
15066,"Fish, pollock, Alaska, raw",56
15267,"Fish, pollock, Alaska, untreated, cooked",80
15266,"Fish, pollock, Alaska, untreated, raw",70
15205,"Fish, pollock, Atlantic, cooked, dry heat",118
15065,"Fish, pollock, Atlantic, raw",92
15069,"Fish, pompano, florida, cooked, dry heat",211
15068,"Fish, pompano, florida, raw",164
15206,"Fish, pout, ocean, cooked, dry heat",102
15059,"Fish, pout, ocean, raw",79
15071,"Fish, rockfish, Pacific, mixed species, cooked, dry heat",109
15070,"Fish, rockfish, Pacific, mixed species, raw",90
15207,"Fish, roe, mixed species, cooked, dry heat",204
15072,"Fish, roe, mixed species, raw",143
15232,"Fish, roughy, orange, cooked, dry heat",105
15073,"Fish, roughy, orange, raw",76
15208,"Fish, sablefish, cooked, dry heat",250
15074,"Fish, sablefish, raw",195
15075,"Fish, sablefish, smoked",257
15237,"Fish, salmon, Atlantic, farmed, cooked, dry heat",206
15236,"Fish, salmon, Atlantic, farmed, raw",208
15209,"Fish, salmon, Atlantic, wild, cooked, dry heat",182
15076,"Fish, salmon, Atlantic, wild, raw",142
15210,"Fish, salmon, chinook, cooked, dry heat",231
15078,"Fish, salmon, chinook, raw",179
15077,"Fish, salmon, chinook, smoked",117
15179,"Fish, salmon, chinook, smoked, (lox), regular",117
15080,"Fish, salmon, chum, canned, drained solids with bone",141
15180,"Fish, salmon, chum, canned, without salt, drained solids with bone",141
15211,"Fish, salmon, chum, cooked, dry heat",154
15079,"Fish, salmon, chum, raw",120
15239,"Fish, salmon, coho, farmed, cooked, dry heat",178
15238,"Fish, salmon, coho, farmed, raw",160
15247,"Fish, salmon, coho, wild, cooked, dry heat",139
15082,"Fish, salmon, coho, wild, cooked, moist heat",184
15081,"Fish, salmon, coho, wild, raw",146
15260,"Fish, salmon, pink, canned, drained solids",138
15265,"Fish, Salmon, pink, canned, drained solids, without skin and bones",136
15084,"Fish, salmon, pink, canned, total can contents",129
15181,"Fish, salmon, pink, canned, without salt, solids with bone and liquid",139
15212,"Fish, salmon, pink, cooked, dry heat",153
15083,"Fish, salmon, pink, raw",127
15087,"Fish, salmon, sockeye, canned, drained solids",167
15182,"Fish, salmon, sockeye, canned, without salt, drained solids with bone",153
15086,"Fish, salmon, sockeye, cooked, dry heat",169
15085,"Fish, salmon, sockeye, raw",142
15273,"Fish, salmon, sockeye, untreated, cooked",143
15272,"Fish, salmon, sockeye, untreated, raw",131
15088,"Fish, sardine, Atlantic, canned in oil, drained solids with bone",208
15089,"Fish, sardine, Pacific, canned in tomato sauce, drained solids with bone",185
15213,"Fish, scup, cooked, dry heat",135
15090,"Fish, scup, raw",105
15092,"Fish, sea bass, mixed species, cooked, dry heat",124
15091,"Fish, sea bass, mixed species, raw",97
15214,"Fish, seatrout, mixed species, cooked, dry heat",133
15093,"Fish, seatrout, mixed species, raw",104
15215,"Fish, shad, american, cooked, dry heat",252
15094,"Fish, shad, american, raw",197
15096,"Fish, shark, mixed species, cooked, batter-dipped and fried",228
15095,"Fish, shark, mixed species, raw",130
15098,"Fish, sheepshead, cooked, dry heat",126
15097,"Fish, sheepshead, raw",108
15100,"Fish, smelt, rainbow, cooked, dry heat",124
15099,"Fish, smelt, rainbow, raw",97
15102,"Fish, snapper, mixed species, cooked, dry heat",128
15101,"Fish, snapper, mixed species, raw",100
15216,"Fish, spot, cooked, dry heat",158
15103,"Fish, spot, raw",123
15105,"Fish, sturgeon, mixed species, cooked, dry heat",135
15104,"Fish, sturgeon, mixed species, raw",105
15106,"Fish, sturgeon, mixed species, smoked",173
15217,"Fish, sucker, white, cooked, dry heat",119
15107,"Fish, sucker, white, raw",92
15218,"Fish, sunfish, pumpkin seed, cooked, dry heat",114
15108,"Fish, sunfish, pumpkin seed, raw",89
15109,"Fish, surimi",99
15111,"Fish, swordfish, cooked, dry heat",172
15110,"Fish, swordfish, raw",144
15262,"Fish, tilapia, cooked, dry heat",128
15261,"Fish, tilapia, raw",96
15113,"Fish, tilefish, cooked, dry heat",147
15112,"Fish, tilefish, raw",96
15274,"Fish, trout, brook, raw, New York State",110
15219,"Fish, trout, mixed species, cooked, dry heat",190
15114,"Fish, trout, mixed species, raw",148
15241,"Fish, trout, rainbow, farmed, cooked, dry heat",168
15240,"Fish, trout, rainbow, farmed, raw",141
15116,"Fish, trout, rainbow, wild, cooked, dry heat",150
15115,"Fish, trout, rainbow, wild, raw",119
15128,"Fish, tuna salad",187
15118,"Fish, tuna, fresh, bluefin, cooked, dry heat",184
15117,"Fish, tuna, fresh, bluefin, raw",144
15123,"Fish, tuna, fresh, skipjack, raw",103
15127,"Fish, tuna, fresh, yellowfin, raw",109
15119,"Fish, tuna, light, canned in oil, drained solids",198
15183,"Fish, tuna, light, canned in oil, without salt, drained solids",198
15121,"Fish, tuna, light, canned in water, drained solids",86
15184,"Fish, tuna, light, canned in water, without salt, drained solids",116
15220,"Fish, tuna, skipjack, fresh, cooked, dry heat",132
15124,"Fish, tuna, white, canned in oil, drained solids",186
15185,"Fish, tuna, white, canned in oil, without salt, drained solids",186
15126,"Fish, tuna, white, canned in water, drained solids",128
15186,"Fish, tuna, white, canned in water, without salt, drained solids",128
15221,"Fish, tuna, yellowfin, fresh, cooked, dry heat",130
15222,"Fish, turbot, european, cooked, dry heat",122
15129,"Fish, turbot, european, raw",95
15223,"Fish, whitefish, mixed species, cooked, dry heat",172
15130,"Fish, whitefish, mixed species, raw",134
15131,"Fish, whitefish, mixed species, smoked",108
15133,"Fish, whiting, mixed species, cooked, dry heat",116
15132,"Fish, whiting, mixed species, raw",90
15224,"Fish, wolffish, Atlantic, cooked, dry heat",123
15134,"Fish, wolffish, Atlantic, raw",96
15225,"Fish, yellowtail, mixed species, cooked, dry heat",187
15135,"Fish, yellowtail, mixed species, raw",146
19187,"Flan, caramel custard, dry mix",348
43075,"Fluid replacement, electrolyte solution (include PEDIALYTE)",10
18973,"Focaccia, Italian flatbread, plain",249
25045,"Formulated bar, high fiber, chewy, oats and chocolate",350
25021,"Formulated bar, LUNA BAR, NUTZ OVER CHOCOLATE",403
25010,"Formulated bar, MARS SNACKFOOD US, COCOAVIA, Chocolate Almond Snack Bar",347
25018,"Formulated bar, MARS SNACKFOOD US, COCOAVIA, Chocolate Blueberry Snack Bar",325
25004,"Formulated bar, MARS SNACKFOOD US, SNICKERS MARATHON Chewy Chocolate Peanut Bar",396
25006,"Formulated bar, MARS SNACKFOOD US, SNICKERS MARATHON Double Chocolate Nut Bar",343
25016,"Formulated bar, MARS SNACKFOOD US, SNICKERS MARATHON Energy Bar, all flavors",386
25008,"Formulated bar, MARS SNACKFOOD US, SNICKERS MARATHON Honey Nut Oat Bar",378
25005,"Formulated bar, MARS SNACKFOOD US, SNICKERS MARATHON MULTIGRAIN CRUNCH BAR",422
25015,"Formulated bar, MARS SNACKFOOD US, SNICKERS MARATHON Protein Performance Bar, Caramel Nut Rush",415
25017,"Formulated bar, POWER BAR, chocolate",363
25020,"Formulated bar, SLIM-FAST OPTIMA meal bar, milk chocolate peanut",386
25031,"Formulated bar, ZONE PERFECT CLASSIC CRUNCH BAR, mixed flavors",422
6327,FRANCO-AMERICAN Fat Free Slow Roast Beef Gravy,34
6328,FRANCO-AMERICAN Fat Free Slow Roast Chicken Gravy,34
6329,FRANCO-AMERICAN Slow Roast Beef Gravy,42
6330,FRANCO-AMERICAN Slow Roast Chicken Gravy,34
6331,FRANCO-AMERICAN Slow Roast Turkey Gravy,42
7023,"Frankfurter, beef and pork",305
42188,"Frankfurter, beef and pork, low fat",152
7945,"Frankfurter, beef, heated",322
42179,"Frankfurter, beef, low fat",230
7905,"Frankfurter, beef, pork, and turkey, fat free",109
7022,"Frankfurter, beef, unheated",316
7024,"Frankfurter, chicken",223
43507,"Frankfurter, low sodium",312
7950,"Frankfurter, meat",290
7963,"Frankfurter, meat and poultry, cooked, boiled",298
7964,"Frankfurter, meat and poultry, cooked, grilled",302
42280,"Frankfurter, meat and poultry, low fat",121
7962,"Frankfurter, meat and poultry, unheated",277
7949,"Frankfurter, meat, heated",278
43130,"Frankfurter, meatless",233
7939,"Frankfurter, pork",269
7025,"Frankfurter, turkey",223
18268,"French toast, frozen, ready-to-heat",213
18269,"French toast, prepared from recipe, made with low fat (2%) milk",229
16173,"Frijoles rojos volteados (Refried beans, red, canned)",144
80200,"Frog legs, raw",73
19240,"Frostings, chocolate, creamy, dry mix",389
19241,"Frostings, chocolate, creamy, dry mix, prepared with butter",408
19372,"Frostings, chocolate, creamy, dry mix, prepared with margarine",404
19226,"Frostings, chocolate, creamy, ready-to-eat",397
19227,"Frostings, coconut-nut, ready-to-eat",433
19228,"Frostings, cream cheese-flavor, ready-to-eat",415
19409,"Frostings, glaze, chocolate, prepared-from-recipe, with butter, NFSMI Recipe No. C-32",359
19375,"Frostings, glaze, prepared-from-recipe",341
19244,"Frostings, vanilla, creamy, dry mix",410
19371,"Frostings, vanilla, creamy, dry mix, prepared with margarine",413
19230,"Frostings, vanilla, creamy, ready-to-eat",418
19246,"Frostings, white, fluffy, dry mix",371
19247,"Frostings, white, fluffy, dry mix, prepared with water",244
19872,"Frozen novelties, Fat Free FUDGESICLE bars",127
19263,"Frozen novelties, fruit and juice bars",87
43506,"Frozen novelties, ice cream type, chocolate or caramel covered, with nuts",323
42074,"Frozen novelties, ice cream type, vanilla ice cream, light, no sugar added, chocolate coated",221
19217,"Frozen novelties, ice type, fruit, no sugar added",24
19281,"Frozen novelties, ice type, italian, restaurant-prepared",53
19280,"Frozen novelties, ice type, lime",128
19387,"Frozen novelties, ice type, pineapple-coconut",113
19283,"Frozen novelties, ice type, pop",79
43514,"Frozen novelties, ice type, pop, with low calorie sweetener",24
19873,"Frozen novelties, ice type, sugar free, orange, cherry, and grape POPSICLE pops",21
43450,"Frozen novelties, juice type, juice with cream",115
43346,"Frozen novelties, juice type, orange",95
19856,"Frozen novelties, juice type, POPSICLE SCRIBBLERS",81
19886,"Frozen novelties, KLONDIKE, SLIM-A-BEAR Chocolate Cone",224
19874,"Frozen novelties, KLONDIKE, SLIM-A-BEAR Fudge Bar, 98% fat free, no sugar added",124
19887,"Frozen novelties, KLONDIKE, SLIM-A-BEAR Vanilla Sandwich",239
19890,"Frozen novelties, KLONDIKE, SLIM-A-BEAR, No Sugar Added, Stickless Bar",242
19891,"Frozen novelties, No Sugar Added CREAMSICLE Pops",72
19871,"Frozen novelties, No Sugar Added, FUDGESICLE pops",105
19892,"Frozen novelties, Sugar Free, CREAMSICLE Pops",49
42186,"Frozen yogurts, chocolate",127
42185,"Frozen yogurts, chocolate, nonfat milk, sweetened without sugar",107
19393,"Frozen yogurts, chocolate, soft-serve",160
42187,"Frozen yogurts, flavors other than chocolate",127
19293,"Frozen yogurts, vanilla, soft-serve",159
19294,"Fruit butters, apple",173
9101,"Fruit cocktail, (peach and pineapple and pear and grape and cherry), canned, extra heavy syrup, solids and liquids",88
9098,"Fruit cocktail, (peach and pineapple and pear and grape and cherry), canned, extra light syrup, solids and liquids",45
9100,"Fruit cocktail, (peach and pineapple and pear and grape and cherry), canned, heavy syrup, solids and liquids",73
9097,"Fruit cocktail, (peach and pineapple and pear and grape and cherry), canned, juice pack, solids and liquids",46
9099,"Fruit cocktail, (peach and pineapple and pear and grape and cherry), canned, light syrup, solids and liquids",57
9096,"Fruit cocktail, (peach and pineapple and pear and grape and cherry), canned, water pack, solids and liquids",32
9351,"Fruit cocktail, canned, heavy syrup, drained",70
14646,"Fruit flavored drink containing less than 3% fruit juice, with high vitamin C",27
14645,"Fruit flavored drink, less than 3% juice, not fortified with vitamin C",64
14647,"Fruit flavored drink, reduced sugar, greater than 3% fruit juice, high vitamin C, added calcium",29
14648,"Fruit juice drink, greater than 3% fruit juice, high vitamin C and added thiamin",54
14651,"Fruit juice drink, greater than 3% juice, high vitamin C",46
14268,"Fruit punch drink, frozen concentrate",162
14269,"Fruit punch drink, frozen concentrate, prepared with water",46
14267,"Fruit punch drink, with added nutrients, canned",47
14264,"Fruit punch drink, without added nutrients, canned",48
14405,"Fruit punch juice drink, frozen concentrate",175
14406,"Fruit punch juice drink, frozen concentrate, prepared with water",42
14541,"Fruit punch-flavor drink, powder, without added sodium, prepared with water",37
9106,"Fruit salad, (peach and pear and apricot and pineapple and cherry), canned, extra heavy syrup, solids and liquids",88
9105,"Fruit salad, (peach and pear and apricot and pineapple and cherry), canned, heavy syrup, solids and liquids",73
9103,"Fruit salad, (peach and pear and apricot and pineapple and cherry), canned, juice pack, solids and liquids",50
9104,"Fruit salad, (peach and pear and apricot and pineapple and cherry), canned, light syrup, solids and liquids",58
9102,"Fruit salad, (peach and pear and apricot and pineapple and cherry), canned, water pack, solids and liquids",30
9325,"Fruit salad, (pineapple and papaya and banana and guava), tropical, canned, heavy syrup, solids and liquids",86
42055,"Fruit-flavored drink, dry powdered mix, low calorie, with aspartame",218
43345,"Fruit-flavored drink, powder, with high vitamin C with other added vitamins, low calorie",227
35142,"Frybread, made with lard (Navajo)",330
11988,"Fungi, Cloud ears, dried",284
17330,"Game meat , bison, ground, raw",223
17332,"Game meat , bison, top sirloin, separable lean only, 1"" steak, cooked, broiled",171
17145,"Game meat, antelope, cooked, roasted",150
17144,"Game meat, antelope, raw",114
17147,"Game meat, bear, cooked, simmered",259
17146,"Game meat, bear, raw",161
17151,"Game meat, beaver, cooked, roasted",212
17150,"Game meat, beaver, raw",146
17153,"Game meat, beefalo, composite of cuts, cooked, roasted",188
17152,"Game meat, beefalo, composite of cuts, raw",143
17333,"Game meat, bison, chuck, shoulder clod, separable lean only, 3-5 lb roast, cooked, braised",193
17334,"Game meat, bison, chuck, shoulder clod, separable lean only, 3-5 lb roast, raw",119
17331,"Game meat, bison, ground, cooked, pan-broiled",238
17335,"Game meat, bison, ribeye, separable lean only, 1"" steak, cooked, broiled",177
17268,"Game meat, bison, ribeye, separable lean only, trimmed to 0"" fat, raw",116
17157,"Game meat, bison, separable lean only, cooked, roasted",143
17156,"Game meat, bison, separable lean only, raw",109
17269,"Game meat, bison, shoulder clod, separable lean only, trimmed to 0"" fat, raw",109
17336,"Game meat, bison, top round, separable lean only, 1"" steak, cooked, broiled",174
17337,"Game meat, bison, top round, separable lean only, 1"" steak, raw",122
17267,"Game meat, bison, top sirloin, separable lean only, trimmed to 0"" fat, raw",113
17159,"Game meat, boar, wild, cooked, roasted",160
17158,"Game meat, boar, wild, raw",122
17161,"Game meat, buffalo, water, cooked, roasted",131
17160,"Game meat, buffalo, water, raw",99
17163,"Game meat, caribou, cooked, roasted",167
17162,"Game meat, caribou, raw",127
17165,"Game meat, deer, cooked, roasted",158
17344,"Game meat, deer, ground, cooked, pan-broiled",187
17343,"Game meat, deer, ground, raw",157
17345,"Game meat, deer, loin, separable lean only, 1"" steak, cooked, broiled",150
17164,"Game meat, deer, raw",120
17346,"Game meat, deer, shoulder clod, separable lean only, 3-5 lb roast, cooked, braised",191
17347,"Game meat, deer, tenderloin, separable lean only, 0.5-1 lb roast, cooked, broiled",149
17348,"Game meat, deer, top round, separable lean only, 1"" steak, cooked, broiled",152
17167,"Game meat, elk, cooked, roasted",146
17339,"Game meat, elk, ground, cooked, pan-broiled",193
17338,"Game meat, elk, ground, raw",172
17340,"Game meat, elk, loin, separable lean only, cooked, broiled",167
17166,"Game meat, elk, raw",111
17341,"Game meat, elk, round, separable lean only, cooked, broiled",156
17342,"Game meat, elk, tenderloin, separable lean only, cooked, broiled",162
17169,"Game meat, goat, cooked, roasted",143
17171,"Game meat, horse, cooked, roasted",175
17170,"Game meat, horse, raw",133
17173,"Game meat, moose, cooked, roasted",134
17172,"Game meat, moose, raw",102
17175,"Game meat, muskrat, cooked, roasted",234
17174,"Game meat, muskrat, raw",162
17176,"Game meat, opossum, cooked, roasted",221
17178,"Game meat, rabbit, domesticated, composite of cuts, cooked, roasted",197
17179,"Game meat, rabbit, domesticated, composite of cuts, cooked, stewed",206
17177,"Game meat, rabbit, domesticated, composite of cuts, raw",136
17181,"Game meat, rabbit, wild, cooked, stewed",173
17180,"Game meat, rabbit, wild, raw",114
17182,"Game meat, raccoon, cooked, roasted",255
17184,"Game meat, squirrel, cooked, roasted",173
17183,"Game meat, squirrel, raw",120
16570,"GARDENBURGER Black Bean Chipotle Burger, frozen, unprepared",149
16581,"GARDENBURGER Flame Grilled Burger, frozen, unprepared",128
16579,"GARDENBURGER Original, frozen, unprepared",159
16584,"GARDENBURGER Savory Portabella Veggie Burger, frozen, unprepared",142
16585,"GARDENBURGER Sun-Dried Tomato Basil Burger, frozen, unprepared",149
16586,"GARDENBURGER Veggie Medley Burger, frozen, unprepared",145
18963,"Garlic bread, frozen",350
11215,"Garlic, raw",149
19172,"Gelatin desserts, dry mix",381
19173,"Gelatin desserts, dry mix, prepared with water",62
19175,"Gelatin desserts, dry mix, reduced calorie, with aspartame",198
19703,"Gelatin desserts, dry mix, reduced calorie, with aspartame, added phosphorus, potassium, sodium, vitamin C",345
19704,"Gelatin desserts, dry mix, reduced calorie, with aspartame, no added sodium",345
19176,"Gelatin desserts, dry mix, reduced calorie, with aspartame, prepared with water",20
19702,"Gelatin desserts, dry mix, with added ascorbic acid, sodium-citrate and salt",381
19177,"Gelatins, dry powder, unsweetened",335
18642,"GENERAL MILLS, BETTY CROCKER SUPERMOIST Yellow Cake Mix, dry",413
18603,"GEORGE WESTON BAKERIES, Brownberry Sage and Onion Stuffing Mix, dry",390
18639,"GEORGE WESTON BAKERIES, Thomas English Muffins",232
11216,"Ginger root, raw",80
28029,"GIRL SCOUTS, Caramel Dulce De Leche Cookies",520
28030,"GIRL SCOUTS, Chalet Cookies",478
28031,"GIRL SCOUTS, Do-si-dos Cookies",478
28032,"GIRL SCOUTS, Samoas Cookies",489
28033,"GIRL SCOUTS, Tagalongs Cookies",558
28034,"GIRL SCOUTS, Thank U Berry Munch Cookies",491
28035,"GIRL SCOUTS, Thin Mints Cookies",502
28036,"GIRL SCOUTS, Trefoils Cookies",498
17168,"Goat, raw",109
5147,"Goose, domesticated, meat and skin, cooked, roasted",305
5146,"Goose, domesticated, meat and skin, raw",371
5149,"Goose, domesticated, meat only, cooked, roasted",238
5148,"Goose, domesticated, meat only, raw",161
5150,"Goose, liver, raw",133
9109,"Gooseberries, canned, light syrup pack, solids and liquids",73
9107,"Gooseberries, raw",44
11785,"Gourd, dishcloth (towelgourd), cooked, boiled, drained, with salt",54
11221,"Gourd, dishcloth (towelgourd), cooked, boiled, drained, without salt",56
11220,"Gourd, dishcloth (towelgourd), raw",20
11784,"Gourd, white-flowered (calabash), cooked, boiled, drained, with salt",13
11219,"Gourd, white-flowered (calabash), cooked, boiled, drained, without salt",15
11218,"Gourd, white-flowered (calabash), raw",14
42139,"Granola bar, soft, milk chocolate coated, peanut butter",536
14277,"Grape drink, canned",61
14282,"Grape juice drink, canned",57
9130,"Grape juice, canned or bottled, unsweetened, with added ascorbic acid",60
9135,"Grape juice, canned or bottled, unsweetened, without added ascorbic acid",60
9512,"Grape juice, canned or bottled, with added ascorbic acid and calcium",62
11975,"Grape leaves, canned",69
11974,"Grape leaves, raw",93
9404,"Grapefruit juice, pink, raw",39
9124,"Grapefruit juice, white, canned, sweetened",46
9123,"Grapefruit juice, white, canned, unsweetened",38
